,episode_number,Episode_title,description,Episode_runtime,Released_on
83,2284,A Traditional Celebration At Gokuldham,"The residents of Gokuldham dress up traditionally and welcome Lord Ganesha on their premises with much fanfare. All the residents perform the aarti. Later, Tappu Sena reveals that the residents must participate in a fancy dress competition that has been specially organized.",19 mins,05 Sep 2017
84,2285,Jethalal Goes Missing,"While everyone is gearing up to perform at the fancy dress competition, Jethalal is confused and unable to decide what he will perform. Just before the function, he goes missing. All the residents of Gokuldham are surprised by his absence. Will he return to perform?",20 mins,06 Sep 2017
85,2286,Jethalal's Absence Creates Panic,"It's almost time for the fancy dress competition to commence and Jethalal has not yet shown up at the venue. Popatlal informs that Jethalal has not decided on his costume and was looking confused when he last met him. Subsequently, Iyer demands that Jethalal must be asked to pay one lakh rupees fine if he does not show up for the programme. Where is Jethalal? Will he show up?",20 mins,07 Sep 2017
86,2287,The Fancy Dress Competition,"Gokuldham knows exactly how to enjoy. They take the society fancy dress competition to an all-new level. Tune in to meet Guru Gobind Singh, Bharat Mata, Ram-Sita with Hanumaan, Narad Muni and many others. Watch the episode right away.",19 mins,02 Jul 2020
87,2288,Jethalal's Worries Continue,"While the residents of Gokuldham continue to showcase their talent by donning different attires for the fancy dress competition, there is still speculation about Jethalal's participation and his costume. The judge is curious to know what character will Jethalal portray in the contest. Will Jethalal spring up a surprise?",20 mins,11 Sep 2017
88,2289,And The Winner Is,"The fancy dress contest at Gokuldham Society reaches its last leg. When Jethalal's turn comes to perform, he stuns everyone by portraying himself as a common man and addressing the common man's problems. Everyone is impressed with his performance. The judges find it extremely difficult to declare the winner. Who will win the coveted contest?",19 mins,12 Sep 2017
89,2290,The Boring Breakfast,"Jethalal is eager to have a sumptuous breakfast. However, he is upset when he finds that Daya has prepared a snack, which is different from the regular fare and refuses to eat. At the same time, Babita gets the same dish prepared from her place. Daya is surprised when Jethalal offers to eat that dish and not the one prepared by her.",19 mins,13 Sep 2017
90,2291,Daya's Love For Jethalal,"Jethalal is upset when he is unable to enjoy his favourite breakfast. He and Mr. Mehta head to a hotel nearby, but they are disappointed when they do not find anything worthwhile there. At the office, Jethalal is surprised when Tappu gets food packed for him and praises Daya for showering him with love.",20 mins,14 Sep 2017
91,2292,Gokuldham's Notice Board Goes Missing,Atmaram Bhide is unable to decide on the Thought For The Day to be written on Gokuldham society's notice board. As he reaches the palace where the board is usually displayed he is shocked to find it missing. He raises a huge hue and cry and asks the members to assemble. How could the board mysteriously disappear?,20 mins,15 Sep 2017
92,2293,Chalu Pandey Returns,"Bhide decides to call the police to find the missing notice board. Inspector Chalu Pandey takes the case in his hands. Suddenly, everyone is surprised to know that Tappu Sena took the notice board. Tapu Sena explains that they took the notice board to repaint it. Everyone is happy to know the reason behind the apparent robbery and all is back to normal in Gokuldham society.",20 mins,18 Sep 2017
93,2294,Tapu's New Smartwatch,"Tapu shows his new smartwatch to Tapu Sena. Sonu tells that Goli strictly needs this smartwatch to manage his weight. Then, Bhide scolds Tapu for buying such an expensive watch. But, Tapu informs that it is just a sample watch from his shop. Meanwhile, all the ladies of the Gokuldham society meet at Babita's house to enjoy a kitty party.",20 mins,19 Sep 2017
94,2295,Professor Bhide Becomes A Shopkeeper,"Abdul asks Bhide to look after his shop until he returns after delivering cold drinks for the kitty party. Bhide faces a problem when a customer asks him for a pen and he is unable to tell its price. Meanwhile, two salesmen enter the society to sell their product. They present their product but nobody buys it. Later, looking at their good behavior, the society members ask them to show their product demo. Will they be able to sell their product to Gokuldham society?",20 mins,20 Sep 2017
95,2296,The Spiked Drink,"The society members call the salespersons to their clubhouse to show the demo. They present their demo in an interesting way to keep the society members entertained. Meanwhile, Abdul leaves for the shop to attend the supplier. The salespersons spike the sample tea with a mixture, which results in the members falling unconscious. Who are the salespersons and what is their intention?",19 mins,21 Sep 2017
96,2297,The Smart Chase,Later Tappu Sena finds most of the Golhuldham residents in an unconscious state at the clubhouse. He makes desperate efforts to wake them up. They decide to catch the two salesmen but are forced to let them go when Gogi is held at gunpoint.  Tapu keeps his smartwatch inside one of the salesman's bag and decides to track them. Will he succeed?,19 mins,22 Sep 2017
97,2298,Chai,"Tapu Sena and Abdul follow Chai-Patti gang and catch them. Meanwhile, Chalu Pandey arrives at the spot and arrests them. Tapu Sena returns to the Gokuldham society delighted. Later, Inspector Chalu Pandey praises Tapu Sena for their smartness and bravery in catching the Chai-Patti gang.",20 mins,25 Sep 2017
98,2299,Taarak's Fashion Statement,"Anjali gives a surprise to Taarak by showing an outfit and requests him to wear this outfit before leaving for office. Meanwhile, Jethalal arrives at Taarak's house. Jethalal plans to pull Taarak's leg by suggesting him to wear the outfit for the office. Frustrated, Taarak decides to wear the outfit and give a presentation in his office. Will Taarak give the presentation in the fancy outfit? Watch this episode of Taarak Mehta to find out.",19 mins,26 Sep 2017
99,2300,Sundar Returns,"Sundar surprises Jethala by suddenly arriving at his shop. He asks Jethala to allow Daya to celebrate Navratri in Ahmedabad with his family members. Later, Bhide makes a phone call to Jethalal to ask him about the society meeting. What will be the subject of the meeting?",20 mins,27 Sep 2017
