,episode_number,Episode_title,description,Episode_runtime,Released_on
65,966,Gokuldham Meets Bebo,"Daya finds a bracelet on the road. It so happens that the bracelet belonged to Kareena Kapoor. Once this is established,this lucky finding leads the Gokuldham society members to meet Kareena Kapoor, who is ecstatic to meet them.",19 mins,17 Feb 2013
66,967,The Upset Tapu Sena,The Gokuldham society members return home after meeting Kareena Kapoor as the society comes to know about this Tapu Sena is upset as they did not take them to meet the star. Who will make the Tapu Sena happy?,20 mins,17 Feb 2013
67,968,The Ganeshotsav Celebrations,"The members of Gokuldham have recently met Kareena Kapoor and there's a lot of discussion going around in the society for that. Meanwhile, Tapu Sena have made their own plans for celebrating Ganesh Utsav. They go to Bhide for finalising the details but he refuses. What will Tapu and his friends do now?",19 mins,18 Feb 2013
68,969,Rats For The Ganpati Festival,"Gokuldham society members are shocked when they come to know that Tapu sena is planning to bring 100 rats in the society but it turns out to be a prank. Meanwhile, Daya gets a huge shock as she fails to find Jethalal in the house, so she informs Bapuji about it. Daya takes a big sigh of relief as she finds Jethalal's letter. Gokuldham society members are extremely excited as Lord Ganesha has arrived in the society.",20 mins,18 Feb 2013
69,970,The Silver Coconut,"As Ganesh utsav begins Madhavi suggests Bhide to keep their traditional silver coconut which is 100 years old in front of Lord Ganesha to which he agrees. All the members of Gokuldham society appreciate Tapu Sena’s efforts for choosing a unique theme. Later, Kanji Lalji Mehta reveals Bhide that he has an idol of Lord Ganesha which is 1000 years old. Bhide decides to buy it and also convinces him to reduce the cost. Will Kanji Lalji Mehta agree to reduce the cost?",21 mins,19 Feb 2013
70,971,Bhide Is Cheated,"Bhide purchases the Ganesha idol and all are excited. He assures them that they will soon progress in life. All the members gather at Bhide's house to seek  blessings, but a major trouble takes place as Bhide reveals that he paid the money to Kanji Lalji Mehta from Gokuldham society's account. The colony members are angry. Further, Iyer reveals a shocking truth to Bhide that the Lord Ganesha's idol that he has bought is not 1000 years old. Will Bhide succeed in finding Kanji Lalji Mehta?",21 mins,19 Feb 2013
71,972,The Antique Idol,"The Gokuldham society members are in a shock after learning that the antique piece they have purchased is fake and they have been duped.. Then, Bhide goes outside and sees Paresh Rawal, who is there to promote his film 'OMG – Oh My God!' in the colony.",18 mins,20 Feb 2013
72,973,Gokuldham Celebrates Ganesh Chaturthi!,The Gokuldham society members celebrate Ganesh Chaturthi in the society and everybody is in a festive spirit.. Jethalal is excited to celebrate the festival with fervour and decides to add some music into the celebratory atmosphere.,21 mins,20 Feb 2013
73,974,Let The Singing Begin!,"An Antakshari competition is being organised and everybody wants to win. Sonu meets her team members and motivates Jethalal to practice singing and Daya too joins Sonu in teaching Jethalal to sing. On the other side, Tapu, Goli, Pinku and Gogi are also practicing hard with their respective team members. In the shop, Tapu and Natu Kaka reveal each other that their team will win, when Jethalal interrupts in between by saying that his team will win. Who will win the Antakshari competition?",21 mins,21 Feb 2013
74,975,Antakshari Times!,The grand Antakshari ka Mahayudh kick starts with the host Amit who introduces all the team leaders.Tapu requests host Amit to announce that the winner will be felicitated with a crown. All the members of Gokuldham society gives a rocking performance in the first round. Which team will score highest in the second round? Which team will succeed in winning the Antakshari Ka Mahayudh?,21 mins,21 Feb 2013
75,976,The Antakshari Battle Continues!,"The teams are giving tough competition to each other and society members get happy as their scores are equal. But before announcing the second round, host Amit explains the rule and regulations of the round. Taarak sings a philosophical song, but Daya sings a Gujarati song instead of Hindi song, and all the female members of Gokuldham society joins in to play Garba with her. While the Antakshari is at its peak, Inspector Chalu Pandey interrupts. Is he going to arrest one of the members?",18 mins,22 Feb 2013
76,977,The Singing Cop,"All the members of Gokuldham society are shocked to see Inspector Chalu Pandey. He informs Gokuldham members that other building people are getting highly disturbed, and decides to arrest Jethalal. Gokuldham members insist Chalu Pandey to sing a song which he used to sing in his college days. Chalu Pandey sings a rocking song and all the colony members dances to hit tunes.",19 mins,22 Feb 2013
77,978,The Buzzer Round,"The Host Amit is tells the members of Gokuldham society that he is surprised to see the bond and unity amongst the members. They begin the music event by giving tribute to the Father of the Nation, Mahatma Gandhi, by singing Vaishnava Janto. In the next buzzer round the participants face some difficulties as Dr. Hathi steps on a wire and Taraak fails to press the buzzer. The society members fight with Popatlal as they accuse him for cheating. Which two teams will qualify for the final round?",41 mins,23 Feb 2013
78,979,A Musical Contest,"In this episode, Gokuldham society members are competing in a singing contest. Taarak, Jethalal, Champaklal are all part of the different teams helmed by Tapu Sena. Who will win this Antakshari contest?",19 mins,24 Feb 2013
79,980,Meet The Maestro Anand Ji!,"In this episode, Anandji of the Kalyanji-Anandji music composer duo, makes a special appearance during the Antakshari competition being organised by the Gokuldham society. Everybody is super excited and try to give their best performanceto impress Anandji Who will win the Antakshari competition?",20 mins,24 Feb 2013
80,981,The Antakshari Aftermath,"Bhide is upset as he feels that he would have won if Sonu would be in his team. He is worried about how his life will change after Sonu’s marriage. Daya and Jetha are sleeping when Daya sings songs in sleep. Jethalal gets disturbed by that. Jetha tries to sleep in hall, but even there the flies disturb him. He goes to Tapu’s room. But, Champak misunderstands him to be a thief and starts shouting.",17 mins,25 Feb 2013
81,982,Sweets From Gujarat!,The female members of Gokuldham are happy and excited about the new Navaratri outfit that Sundar has sent all the way from Gujarat. Jethalal informs all the female members that he has ordered sweets and farsans for all the colony members. Jethalal rages at Sunder as he was persuading him to deliver the boxes in Dockyard before 11 a.m. But female members find a rocking solution to Jethalal’s box problem. Will Jethalal succeed in delivering the boxes?,20 mins,03 Mar 2013
82,983,The Three Generations,"Bapuji gets frightened as he assumes an unknown person in his room and starts beating him and Tapu too joins him. Later both of them realise that it is Jethalal and not a thief. Bapuji, Jethalal and Tapu decide to sleep together despite the bed being too small for three persons. The next day Jethalal leaves for his shop and finds Nattu Kaka and Bagha are worried that malls have increased and competition. Jethalal assures that customers will definitely buy electronics items from his shop.",19 mins,03 Mar 2013
83,984,The Bomb,"Jethalal is getting frustrated as he is not able to find the person who is sending boxes to Jethalal. He urgently calls police to the Gokuldham society and all of them rush out of Gada house, as Police reveals that there might be a bomb inside the box. Is there  trouble waiting for all the colony members? Who is sending boxes to Jethalal?",21 mins,04 Mar 2013
84,985,Evacuate Gokuldham!,Members of society are worried as they observe Police in Gokuldham. Jethalal informs Police that an unknown person has sent 30 boxes in Gada house. The police insist all members to vacate the colony urgently. Bomb squad searches for a bomb in Gada house but they fail to find any bomb and there is sigh of relief. Police open the box and get shocked. Is there a trouble waiting for Jethalal and his family? Will Police arrest Jetha?,18 mins,04 Mar 2013
85,986,A False Alarm,"Its morning and all the members of Gokuldham society are still waiting outside the building as Inspector and his team check each and every box and get shocked too. Members of Gokuldham society are surprised to see female outfits in the boxes, and everyone takes a big sigh of relief. Iyer forces Jethalal to apologize to the Inspector. Sundar reveals Jethalal that he has sent the box full of female outfits. Will Sundar apologize to Jethalal?",20 mins,05 Mar 2013
86,987,Rocking Solution,"The female members of Gokuldham society are happy about the new Navratri outfit that Sundar has sent. Later, Jethalal informs all the female members that he has ordered sweets and farsans for all the colony members. Jethalal rages at Sunder as he was persuading him to deliver the boxes in dockyard. Jethalal strictly disagrees to deliver his boxes before 11 AM as Dockyard is too far. Gokuldham's female members find a rocking solution to Jethalal's box problem.",20 mins,05 Mar 2013
87,988,The Delivery,"The time is running out and Jethalal has to reach the dockyard. He takes the help of Gokuldham society members to get the boxes to the van, which Nattu Kaka is driving. Once the boxes are loaded, Jethalal can reach the dockyard. Will Jethalal reach the dockyard in time?",19 mins,06 Mar 2013
88,989,A Rocky Ride,"Jethalal is in a hurry, but not everyone is on the same page. Nattu Kaka and Bagha, who is the driver, make life miserable for Jethalal. Bagha's rash driving makes sure that a box falls on the ground and delays Jethalal's arrival at the dockyard.",20 mins,06 Mar 2013
89,990,The Traffic Police,In their hurry to ensure that they reach the dockyard in time with the boxes a few traffic rules are broken and the traffic police catches them. We see a desperate Jethalal dealing with the traffic police and trying to convince them so that he can reach his destination on time..,20 mins,07 Mar 2013
90,991,Out Of Fuel!,"Although they are able to sort things out with the traffic police Jethalal, Nattu Kaka and Bagha face several problems on their way to the dock. A new misfortune strikes as this time they run out of fuel fand their vehicle stops en route much to the disappointent of all.",21 mins,07 Mar 2013
91,992,The Boxes,"Desperate times call for desperate measures and Jethalal wants to get rid of the boxes as soon as possible. However, he fails to find a prospective buyer for the clothes. Then, he gets a call from Sundar, who wants to know if the boxes have been sold. Is there a ray of hope for Jethalal?",20 mins,08 Mar 2013
92,993,The Gada Boutique,"Meanwhile Jethalal gets a call from Babita. She informs him about a prospective buyer for the clothes. In a desperate attempt to sell the clothes, Jethalal turns his electronics shop into a boutique.",20 mins,08 Mar 2013
93,994,Tony TV,"The head of Tony TV, Chingchuli gets shocked to see Jethalal's electronics shop as female outfits were scattered all around in the shop, especially on the brand new LED and LCD television. Jethalal finally convinces the head of Tony TV not to cancel the dealership as highest number of Tony Television gets sold from his shop.Jethalal and Daya invite Mr. Chingchuli and his wife to play Garba with them and he agrees to come. Will Chingchuli arrive in Gokuldham society?",18 mins,09 Mar 2013
94,995,The Chinese Navratri,"All the members of Gokuldham society are eagerly waiting for Mr. and Mrs. Chingchuli. As they arrive, Gokuldham colony welcomes them with a bouquet of flowers. The Gokuldham members worship Goddess and later enjoy the festival of Navaratri by playing Garba with Mr. and Mrs. Chingchuli. Later, Taarak decides to write book on Jethalal’s life as trouble knocks his door daily. A romantic moment takes place between Daya and Jethalal. Will Bapu Ji punish Jethalal?",19 mins,09 Mar 2013
95,996,The Never Ending Problem,"Bapu Ji fumes in anger as Jethalal had twisted his hand assuming him as Daya.  Sundar calls Jethalal and also reveals him that he is sending gifts for Tapu, Daya and Bapu Ji too. Irritated, Jethalal shares his problem with Taarak and also requests him to solve his never ending problems. Babita introduces Iyer’s brother-in-law Dibakar to Jethalal. Will Taarak solve Jethalal’s never ending problems?",19 mins,10 Mar 2013
96,997,Somebody Save Jethalal!,"Iyer gets extremely happy as his brother-in-law Montu has send a rocking gift for him. Sundar again tries to fool and irritate Jethalal, but he avoids him. Jethalal shares his problem with Bagha and Nattu Kaka in a unique way. Nattu Kaka comes up with several useless ideas and Jethalal gets angry. Jethalal finds a rocking way to solve his biggest problem. Will Dukhmanjan Maharaj solve Jethalal’s never ending problem? Will Jethalal be able to get rid of Sundar?",19 mins,10 Mar 2013
97,998,A Bizarre Solution,"Jethalal gets excited as Dhukhmanjan Maharaj reveals Jethalal that the only and the permanent solution to get rid of his Brother-in-law Sundar is Saala Shanti Hawan and also tells him to reach temple next day at 8am sharp. Later in Gada electronics shop, Jethalal orders delicious items for Bagha and Nattu Kaka and also decides to conduct Hawan for Bagha, Nattu Kaka and Bhide. Will Jethalal reach on time? Will Dhukmanjan solve Jethalal's never ending problem?",19 mins,11 Mar 2013
98,999,Make Way For A New Problem,Jethalal finally reaches the temple to meet Dukhmanjan Maharaj. Jethalal gets a huge shock as he comes to know that Dukhmanjan Maharaj has left for the day. Jethalal spots Dukhmanjan Maharaj in the temple and the auspicious Saala Shanti Hawan finally begins in the temple. Taarak gets a huge shock as he spots Daya and Anjali proceeding towards the temple. What will happen when Daya will come to know that he has organized a hawan to get rid of Sundar?,18 mins,11 Mar 2013
99,1000,Natu Kaka's Unique Way To Convince Jethalal To Increase His Salary,"Dhukhmanjan Maharaj reveals Jethalal that the puja that he has organized to get rid of his brother-in-law is successfully completed and also assures him that henceforth, Sundar will never ever create trouble for him, but a major trouble takes place as Daya and Anjali come to know about Jethalal's Sala Shati Hawan and Sundar too arrives with her sister. Natu Kaka tries unique ways to convince Jethalal to increase his salary. Will Jethalal increase Natu Kaka's salary?",19 mins,06 Nov 2012
