,episode_number,Episode_title,description,Episode_runtime,Released_on
82,1083,The Broken Lock,"The society sees that there is a broken lock in the staircase of a building and someone has locked themself from inside. However, they are not able to figure out who it exactly is.",19 mins,26 Mar 2020
83,1084,The Unexpected Patient,"The society members are on the terrace of their buildings when Daya finds an unknown woman lying unconscious. The members panic and decide to take her to Dr. Haathis place. While everyone is worried about her well-being, Popatlal wants to know her marital status.",19 mins,26 Mar 2020
84,1085,English Lessons,"Jetha signs on some papers that Nattu Kaka brings to him and asks him for tea. As soon as Jetha demands tea, Bagha comes running with a cup of tea. Jetha gets busy with work while Nattu Kaka and Bagha start talking and arguing in English.",20 mins,26 Mar 2020
85,1086,Bharti Is Ready,"After the ladies of Gokuldham society find out the reason behind an unknown woman being in their society, they tell her - Bharti that it is important to fight back and Daya tells her the plan of doing so. Bharti is happy that she got the support of the ladies and thanks to them for giving her strength and making her ready to fight.",18 mins,26 Mar 2020
86,1087,The Fight,"Daya leads all the members of the society to help her to deal with the people harassing Bharti. After they reach the spot, Daya explains the plan to the men and the Gokuldham society members are ready to fight injustice.",17 mins,26 Mar 2020
87,1088,Women Are Not Objects,The police manage to come on time when they are called and the police decide to take the boys to their parents and tell the parents what their children are up to. They are explained that women are not objects and that they have to be respected instead of being molested.,19 mins,26 Mar 2020
88,1089,Daya Makes Fun Of Jetha,Tapu asks Jetha a question about studies when he states that anything related to study can only be cleared by Bhide. Babuji taunts Jetha about him not being educated enough. Jetha counter taunts and they start arguing. Daya makes fun of Jetha and supports Babuji.,17 mins,26 Mar 2020
89,1090,The Dog Chase,"As Jetha is getting home, he is chased by a dog. He starts running and is scared. After he reaches the Gokuldham society, he realizes that the dog was not behind him and he curiously sees as to where the dog is going.",19 mins,26 Mar 2020
90,1091,Be Kind To All,"After a scared and worried Jetha goes home, somehow missing the dog, he sees Daya is missing in the night. Concerned, he goes out to see her feeding the dog. She tells him to be kind to all the living beings.",19 mins,26 Mar 2020
91,1092,Empathy,"Jetha is terrified of dogs and when he sees Babita feeding him the next day, he asks her not to do so. She tells him that a dog is harmless but when the dog starts growling, Jetha gets scared and rushes home.",20 mins,26 Mar 2020
92,1093,The Muncipal Corporation Intervenes,"After Jetha is too annoyed by the dog, he calls up the municipal corporation to intervene and asks them to take away the dog. However, after people from the corporation come, no one in the society is ready to give away the dog.",19 mins,26 Mar 2020
93,1094,Jetha Dines With Natu Kaka And Bagha,"Jetha is standing outside a dog shop with the supplies and calls up Nattu Kaka to ask about his whereabouts and when he gets to know that they have not had their dinner yet, he tells them that he will dine with them.",19 mins,26 Mar 2020
94,1095,Babita Waits For Jetha,"Jetha is going out when he asks Daya to get ready to go with him. Just as they are about to leave, Babita and Iyer come home. Babita tells Jetha that she had been waiting for a long time for him.",20 mins,26 Mar 2020
95,1096,A Mans Best Friend,Iyer asks the society the main reason behind them not wanting a dog and then tells everyone that dogs only bite the people who have a bad intention- and that a dog is a man's best friend.,19 mins,26 Mar 2020
96,1097,Is Gogi At Fault?,"Tarak tells everyone that Gogi is not at fault and they all are wrong. Elsewhere, Gogi sits quietly in his room. But Champaklal tries to tell them that they are thinking wrong and Gogi should try keeping up to their expectations.",19 mins,26 Mar 2020
97,1098,Bhides Surprise,"Bhide gets surprised at Madhavis welcome and then she expresses her happiness. Then they discuss Gogis situation and the tough system for kids. Elsewhere, Tarak tells Anjali about Gogi going to his exam with confidence.",20 mins,26 Mar 2020
98,1099,Surprise For Babita,"This episode starts with a little bee, which has become a headache for Jaya and Jethalal. Meanwhile, Iyer is planning a chain of surprises for his wife Babita- he has envisioned a new, different kind of engagement day. What all surprises will Babita get?",19 mins,26 Mar 2020
99,1100,Jetha Gives A Task,Jethalals unique mission - Baagha and Natu Kaka get a dangerous task from Jethalal. Baagha and Natu Kaka obey Jethalals orders. Baagha and Natu Kaka are on a mission. Will they succeed or fail? Will Baagha and Natu Kaka get caught?,20 mins,26 Mar 2020
