,episode_number,Episode_title,description,Episode_runtime,Released_on
75,2676,Cross Questioning,"After Popatlal and Sodhi successfully manage to escape from Gokuldhaam Society, Sodhi's friends are on their way to meet him. Sodhi tries to reach them but his phone is dead and his friends turn up at Bhide's house. They start asking questions. Jethalal is caught in the crossfire of the questions. Will he be able to save himself?",21 mins,27 Feb 2019
76,2677,The Party Begins,"As the party has started for Sodhi, Madhavi remembers that in all this haste, she forgot to ask Popatlal for dinner and wants to call him for dinner. Jethalal smartly takes care of the situation but they have bigger trouble coming towards them. What is the trouble?",21 mins,28 Feb 2019
77,2678,The Truth Is Out,"Jethalal tries to stop Roshan from entering her house but in vain, as Roshan, in order to check on Sodhi, decides to enter her house. Roshan doesn't find Sodhi and calls him up. Not knowing that Roshan is in Gokuldham, Sodhi lies to her that he is taking rest in the house. All the lies that Jethalal had built up get exposed. What will happen to Jethalal and Sodhi now?",20 mins,01 Mar 2019
78,2679,Gang In Trouble,"After Sodhi's truth is exposed, Champaklal gets angry and he asks for the whole truth. Taarak tells Champaklal about where Sodhi and Popatlal are. Champaklal takes up the hockey stick and runs after them to hit them. A scared Jethalal has locked himself up in his house. What will happen next?",19 mins,04 Mar 2019
79,2680,Sodhi And Popatlal Are Caught,"After their lie is caught and they reach Sodhi's friend's place, they first send Jethalal, Taarak, Haathi inside and then barge in. Roshan is very angry with Sodhi and runs after him with a hockey stick. How will this scenario end?",22 mins,05 Mar 2019
80,2681,Sodhi's Confession,"After the whole of Gokuldhaam has arrived on the scene, Roshan gives Sodhi a chance to explain himself, where he narrates the situation as it happened. Roshan isn't ready to believe Sodhi and threatens him with her going to her parent's house. Will Sodhi be able to convince her?",20 mins,06 Mar 2019
81,2682,The Result,"As everything has ended on a good note between Sodhi and Roshan, Gokuldham society members look forward to a new day. Champaklal is elated after learning that Sonu's essay has been shortlisted for the national essay competition. The next day, the results are announced and Sonu is declared the winner. Tapu Sena is happy after hearing the news. What new challenges will come their way?",21 mins,07 Mar 2019
82,2683,The Workshop,Sonu has topped the essay competition and gets a chance to go on a workshop to Delhi. Sonu is dejected after finding out that the workshop is for one month. Tapu Sena comes to know that Bhide will not allow Sonu to attend the workshop. Tapu decides to come up with a plan to convince Bhide. Will Tapu succeed?,19 mins,08 Mar 2019
83,2684,Sonu Goes To Delhi,"Tapu Sena along with the ladies club, try to convince Bhide, that if Sonu misses the workshop she will be missing a huge opportunity in her life. Will Bhide listen to them? Will he allow Sonu to go for the workshop?",19 mins,11 Mar 2019
84,2685,Search for Popatlal's Bride,"Popatlal begins his search for a bride and calls up Asit Kumar Modi. Popatlal then calls up various marriage bureaus and requests them to find a prospective bride for him. Then, Bhide pays a visit to Popatlal and gets to know from him about his search for a bride. Popatlal gets a call from a marriage bureau and the agent informs him about a prospective bride. Watch the full episode to find out who the girl is.",20 mins,12 Mar 2019
85,2686,The Misunderstanding,"Popatlal rushes to the marriage bureau with Bhide to meet the two women who have shown interest in his profile. But, things don't turn out as expected and Popatlal is dejected after finding out that the women have by mistake selected Popatlal's profile. Popatlal walks out of the marriage bureau and returns to Gokuldham society disappointed.",20 mins,13 Mar 2019
86,2687,The Disappointment,"The ladies of Gokuldham society decide to cheer up a dejected Popatlal but following the fiasco at the marriage bureau, Popatlal is heartbroken and is in no mood to mingle. The men of Gokuldham society gather at Abdul's shop and discuss Popatlals marriage. Sodhi learns about Popatlals heartbreak and decides to meet him.",20 mins,14 Mar 2019
87,2688,Popatlal's Misery,The Gokuldham society members try to cheer up Popatlal but Popatlal is dejected following the fiasco at the marriage bureau. Popatlal shouts at Bhide and Taarak Mehta and leaves for his house. Taarak Mehta and others don't give up and decide to meet Popatlal at his house. Will Popatlal come out of sombre mood?,20 mins,15 Mar 2019
88,2689,The Great Depression,"Everyone is tense in Gokuldham Society regarding Popatlal's condition. Haathi tells Komal that if this is how it goes, Popatlal will go into a depression, where a person won't even feel like eating. Everyone decides to cheer up Popatlal. Will they be able to do so?",20 mins,18 Mar 2019
89,2690,Popatlal's Despair,"Champaklal tries to help Popatlal get out of depression but Popatlal doesn't see light at the end of the tunnel. Jethalal and Taarak Mehta decide to make Popatlal happy by gifting him a brand new phone but this plan also fails. Then, Sodhi comes up with an idea to invite Popatlal for a party but Popatlal declines the invitation. How will Popatlal get out of despair?",20 mins,19 Mar 2019
90,2691,Happy Holi,"The Gokuldham Society members are worried about Popatlal. The society members are shocked seeing Popatlal, who arrives for the pooja, covering his mouth. He avoids the society members and answers only through a series of notes. As Holi beckons the society members, will the Gokuldham society members celebrate this Holi without Popatlal?",20 mins,20 Mar 2019
91,2692,The Message,"The Gokuldham Society members are celebrating Holi with fervour. Tappu notices that Popatlal hasn't come out of his house. The society members meet Popatlal and try to convince him to play Holi. , A woman arrives at Gokuldham and informs that she has a message for Popatlal as well as the Gokuldham Society members. What is this message about?",21 mins,21 Mar 2019
92,2693,A Strange Message,Popatlal receives a strange message from a stranger. Taarak plays the message on his laptop on which there appears a strange man with a message for all of them saying that they received a free ticket to Singapore. Who is this strange man?,20 mins,22 Mar 2019
93,2694,The Emergency Meeting,"Bhide and Jethalal are reassured that the Singapore trip is fully financed. Bhide calls for an emergency meeting to discuss whether Gokuldham society members should go to Singapore. During the meeting, the Gokuldham society members express their desire to go to Singapore but Popatlal is against the decision. How will the Gokuldham society members convince Popatlal? Watch the full episode and find out.",20 mins,25 Mar 2019
94,2695,Singapore Confirmation,The members of Gokuldham manage to make Popatlal agree for the trip to Singapore. The dates of the trip though cause various problems to each of the families for several members. Will they manage to go to Singapore?,20 mins,26 Mar 2019
95,2696,Gokuldham To Singapore,All the ladies help Popatlal for packing his stuff for which he is very obliged. Bhide gets a call from Thomas cook informing them not to book a cab to reach the airport as they have special arrangements for them. Everybody reaches Singapore and are super excited. Stay tuned for more.,19 mins,27 Mar 2019
96,2697,Jethalal Rides To Sentosa,"Gokuldham is finally in Singapore. They ride to the hotel and they love the place, as the hotel executives make them feel at home. Jetha decides to go visit Sentosa and rides a bike with his father. Watch father and son ride away on the streets of Singapore.",19 mins,28 Mar 2019
97,2698,Gokuldham Is Finally In Singapore,"Gokuldham is finally in Singapore. The whole Gokuldham is planning to explore the Singapore city, but Jethalal gets confused while seeing Singapore's map. How will Jethalal manage in Singapore?",20 mins,29 Mar 2019
98,2699,Everyone Enjoys The Amusement Park,Jethalal has sweet words with Babita on a giant wheel ride. Others enjoy the amusement park unknown of the fact that they are being spied on. Who is the Spy?,19 mins,01 Apr 2019
99,2700,Bungee Jumping,"After Babita asks about the best place in Santosa, Jehtalal finds out about it from a local who suggests Bungee Jumping to Jethalal. An unaware Jethalal takes everyone for the event but when he sees what actually it is, he is scared to death. What will he do?",20 mins,02 Apr 2019
