,episode_number,Episode_title,description,Episode_runtime,Released_on
79,2981,Blissful Sleep At Last,"Jethalal, after having managed to extend his helping hand to a needy person, finally feels satisfied. This brings him a peaceful sleep and he gets rid of his bad dreams. As he goes about thanking all those who helped him with ideas and suggestions, Sundar comes up with yet another demand. Watch this Ganapati Puja special episode to know more.",20 mins,28 Aug 2020
80,2982,One Man Army,"Being the society secretary, Bhide brings up the topic of organising the Ganesha Puja in Gokuldham and seeks help from the other society members. But everyone exaggerates about how they have full confidence in Bhide’s organising skills and all the related work falls on his head. But this is of no help to Bhide. Watch the episode to find out what happens next.",21 mins,31 Aug 2020
81,2983,Tapu Sena At Task,"When Bhide does not receive any help from the society members for organising the Ganesh Puja in Gokuldham, he gets fed up and almost drops the plan. However, Tapu Sena extends a helping hand and assures that they will take charge of organising the puja seamlessly, keeping in mind the government norms. Will Tapu Sena succeed in their task? Watch this episode to know.",21 mins,01 Sep 2020
82,2984,Tapu Sena’s Taiyaari,"Tapu Sena is all set to ensure that the Ganapati Utsav is celebrated with lots of fun and masti. They come up with unique ideas and there are gifts for the winners too! Amidst all the fun, Jethalal seems to be in a confused state. What is the reason for Jethalal’s confusion? Watch this festive episode to know better.",21 mins,02 Sep 2020
83,2985,"Tapu Sena, The Smart Organisers","Tapu Sena proves to be a bunch of smart organisers, as they chalk out an entertaining rangarang event in Gokuldham to mark the celebration of Ganesh Utsav. The event is well organised keeping all the necessary government rules in mind with respect to the recent pandemic times. Stay glued to this episode, as the residents showcase their performances through songs, dance, recitation and much more.",21 mins,03 Sep 2020
84,2986,Mystery Lady,"The fun-filled entertainment programme has begun in Gokuldham. The residents are delighted and eager to perform. Dr. Haathi and Tapu Sena bring about a wonderful performance. Amidst all the enjoyment, a random woman walks in. Why is she in the society? Watch this episode to know.",21 mins,04 Sep 2020
85,2987,Rangarang Some More,"Gokuldham is immersed in the festive spirits and the Rangarang programme has picked up pace. Coming up next are the lovely performances by Chacha ji, Roshan, and Sodhi followed by a quiz competition hosted by Bhide. Will the members of Gokuldham Society nail the quiz competition too? Stay tuned to the episode to find out and enjoy the fun and entertainment with Gokuldham residents.",21 mins,07 Sep 2020
86,2988,Jetha Aur Babita Ki Doori,"Bhide’s part in the Rangarang event is a quiz show, which he pulls off perfectly. The quiz is all the more fun as the questions revolve around Lord Ganpati himself. Once the quiz ends, everyone is eager for the next performance which is to be presented by Babita and Iyer. Parallelly, Jethalal runs into deep trouble which robs him of all the fun and frolic. What could have gone wrong at Jetha’s end? Don’t forget to look for the answer in this episode.",19 mins,08 Sep 2020
87,2989,Rangarang Finale,"Almost a week long Ganapati Special Rangarang event comes to its last leg. On the beautiful evening of the event finale, Jethalal delivers a touching and meaningful speech encompassing the difficult situations that everyone is going through in the corona infected times. The residents seek the Lord’s blessings and there is hope in everyone’s heart that he can fix the present situation soon.",21 mins,09 Sep 2020
88,2990,Ganapati Utsav Wrap Up,"All the glitz and fun of Ganapati Utsav’s Rangarang Karyakram comes to an end. Gokuldham bids a loving adieu to Lord Ganesha. With the end of the event, Bhide’s headache begins as he has to tally the expense budget for the celebration. Tapu is a tough nut to crack as Bhide chases him for the budget details. Watch this episode to find out if Bhide’s headache will ease.",20 mins,10 Sep 2020
89,2991,The Prankster Tapu Sena,"True to the promise, Tapu Sena goes to each household to hand over gifts on the occasion of Ganesh Utsav. But when it is Bhide’s turn to receive the gift, Tapu Sena pulls a prank on him. Apart from the prank, Tapu Sena also ends up making him tense. Will Bhide fall for Tapu Sena’s prank? Why does Bhide get tense? Watch this episode to find all your answers.",21 mins,11 Sep 2020
90,2992,Smart Gifts,"Tapu Sena’s gift distribution continues. What is noteworthy about the gifts chosen by Tapu Sena is that each of the gifts is useful to the recipients and they are surely expected to benefit with the gift’s usage. The residents are quite pleased upon receiving the gifts. If you wish to know what gifts Dr. Haathi, Mr. Mehta, Babita and Popatlal receive, then you cannot miss this episode.",21 mins,14 Sep 2020
91,2993,Special Gifts For Abdul And Jetha,"Tapu Sena has ensured that all residents of Gokuldham receive their respective gifts. They are almost done with the distribution. Only Abdul and Jethalal remain to be gifted. True to the expectation, Tapu Sena has very special and unique gifts for both of them. However, the saying “all's well that ends well” does not seem to be the case for Tapu and his gang. They are in for trouble. Watch and find out what trouble awaits Tapu Sena.",21 mins,15 Sep 2020
92,2994,Bhide’s Nightmare Becomes Reality,"Bhide has a nightmare in which he is being chased by various vendors for payment related to purchases made during Ganesh Utsav. What seems like a nightmare is soon turned to reality when vendors start following him up for pending payments. An angry Bhide tries reaching out to Tapu Sena who had organised everything. Much to his irritation, Tapu Sena is unresponsive. Left with no other choice, Bhide takes the next step. Watch this episode to find out what will Bhide no next?",21 mins,16 Sep 2020
93,2995,Vendors Blame Residents,"In order to tackle the repeated follow-ups from vendors for their pending payments, Bhide calls for an urgent meeting with all residents. All turn up for the meeting except Jethalal. After a long time, he finally arrives for the meeting and gets into a fight with Bhide who targets Jetha in his anger and frustration. The vendors who are already irked call them frauds. This invites a strong reaction from Sodhi. What is Sodhi up to? Watch this episode to get answered.",21 mins,17 Sep 2020
94,2996,Chalo Police Station!,"A new tension arrives in Gokuldham as due to the vendor’s complaint, the police comes to the society. Though the society members try to settle the matter, the inspector asks the Gokuldham men to come along with him to the police station. Will Gokuldham come out of this or is this just the beginning of a new problem for them? Watch to know.",21 mins,18 Sep 2020
95,2997,Tapu Sena Saves The Day,"The residents of Gokuldham are about to be taken by the police. But Tapu Sena arrives at the right time and help avoid the insult. They have finally acquired sponsorship from the US, taking Gokuldham’s Ganapati Visarjan to an international level.",22 mins,21 Sep 2020
96,2998,Closed Till Further Notice,"Due to the lockdown, Jethalal has suffered heavy loss in his business, so he is excited to open Gada Electronics and get his life back on track. He also seeks permission from Champaklal and Tapu to open the shop and asks Bagha to reach the shop with its keys. But Jethalal’s excitement is short-lived, as Bagha straight away refuses to bring the keys and also asks Jethalal to return home. Why would Bagha say something like that? Tune in to this hilarious episode to find out.",21 mins,22 Sep 2020
97,2999,Fafda Party For Mehta,"Jethalal returns home disheartened, but Champaklal lightens his mood with fresh homemade Fafda. As Jethala enjoys the Fafda, he gets a call from Taarak. However, when Jethalal informs him about Bapuji’s special Fafda, Taarak feels sad for having to skip unhealthy snacks and eating Anjali’s nutritious diet. Hence to cheer his friend up, Jethalal decides to make Taarak eat the Fafda in front of Anjali. But how? Tune in to this episode to find out.",21 mins,23 Sep 2020
98,3000,Together Till 3000!,"Taarak Mehta Ka Ooltah Chashmah attains its 3000 episodes or rather 3000 happysodes. On this memorable milestone, the viewers are taken along this journey that never failed to bring fun, laughter, happiness and smiles in their lives. Join the team to celebrate this journey of 3000.",21 mins,24 Sep 2020
