,episode_number,Episode_title,description,Episode_runtime,Released_on
76,2577,Under Arrest,"As Jethalal is smoothly handling Gupta Ji's Pani Puri stall, some people from the Municipal Corporation come and take him to the police station and take Jethalal and other vendors with them as apparently they were standing there without any permission.",19 mins,16 Oct 2018
77,2578,Confined,"Jethalal gets into big trouble when the police arrest him for selling Pani Puri at Gupta Ji's stall without any license. Bagha and Nattu Kaka go to the police station to get him out but fail. Later, Champaklal, Popatlal, and Bhide also reach there after hearing the news.",20 mins,17 Oct 2018
78,2579,The Explanation,"Jethalal is in police custody and everyone from Gokuldham society tries to get him out. Inspector Chalu Panday files a case against him for selling eatables on the street without a license. But when Jethalal starts to explain everything to everyone about what has been happening, Chalu Panday realizes that he's innocent.",20 mins,18 Oct 2018
79,2580,Finding The Orchestra,"Everything was going right in the Gokuldham society after Jethalal comes out of the lock-up, but another problem arrives when the orchestra that Bhide booked for the Navratri Garba Nights cancels. Everyone tries to book another orchestra, but all of them are booked.",20 mins,19 Oct 2018
80,2581,Garba Nights Cancelled?,Everyone is worried in the Gokuldham Society as the orchestra that was supposed to play in the Garba Nights cancels. Jethalal comes to the rescue and promises everyone that he'll find the orchestra but after trying really hard he's not able to find it either. Will the Garba Nights be canceled?,21 mins,20 Oct 2018
81,2582,The Struggle Is Real,"Jethalal is struggling really hard as he is still not able to find the orchestra for the Garba nights, so he decides to take Mehta's help. Things get even more serious when Mehta is not able to help him either. As a last resort, Jethalal is forced to call up Sunder and ask him for help.",20 mins,22 Oct 2018
82,2583,Jethalal Runs Away,"Everyone gets dressed for the Garba Night celebration and comes to the society compound. Jethalal tells everyone that the orchestra is on its way and they should start the Pooja first. While everyone is busy worshipping, Jethalal runs away from the society.",20 mins,23 Oct 2018
83,2584,Garba With A Twist,"Everyone in the Gokuldham society is eagerly waiting for the Nacho Orchestra to arrive so they could start the Garba nights but when the orchestra arrives in the society, everyone is shocked to see that Nacho Orchestra is actually a group of foreigners.",19 mins,24 Oct 2018
84,2585,The Garba Fun,The Garba Nights continue as the Nacho Orchestra continue to mesmerize the Gokuldham Society members with their unique style of Garba songs. The next day tensions start to rise between Bhide and Popatlal as Popatlal takes some money from Bhide and is not able to return it in time.,20 mins,25 Oct 2018
85,2586,Soda And Chat Session,"While all the men are waiting for Popatlal to arrive at Abdul's shop to have some soda and chat session, Popatlal is stuck with a couple on the road who claim that their daughter is sick, and they ask Popatlal for some money to get their daughter treated. What will Popatlal do?",20 mins,26 Oct 2018
86,2587,The Lottery Ticket,Popatlal comes back to the Gokuldham society and sits with the men to enjoy his soda session as he tells them why he got late. Popatlal also tells them about the lottery ticket that the couple gave him but Bhide still doesn't believe him.,20 mins,27 Oct 2018
87,2588,The Midnight Assignment,"Popatlal gets a call from his boss, who asks him to go on an assignment. After learning that Sonia, a reporter from Delhi will be accompanying him, Popatlal agrees to go on the assignment. Popatlal hopes that Sonia will be his future wife and puts on a suit to impress her.  Will Popatlal find his future bride this time?",20 mins,29 Oct 2018
88,2589,Winning The Lottery,"Bhide finds out that Popatlal has won the 1 crore lottery and has become a crorepati now, so he gathers all the Gokuldham society members and gives them the good news. All of them decide to inform and celebrate the news with Popatlal, but he's nowhere to be seen.",20 mins,30 Oct 2018
89,2590,Losing The Ticket,"Everyone in the Gokuldham Society gathers outside Popatlal's house. When they inform him that he has won the lottery, he goes crazy. He decides to take all the members to Goa on a trip that he'll pay for. But things go sideways when Popatlal realizes that the Lottery ticket is in the shirt he gave in the laundry.",20 mins,31 Oct 2018
90,2591,Finding The Laundry Man,"Popatlal informs and explains to everybody in the society how he put the winning lottery ticket in the shirt, which he gave in the laundry, but later they find out that the laundry shop is closed. So they decide to find the laundry man's house and confront him.",20 mins,01 Nov 2018
91,2592,In Search Of The Lottery Ticket,"Popatlal, accompanied by Gokuldham society members, arrives at the Dhobi Ghat in search of the laundryman, who took his shirt and along with it the lottery ticket.  The laundryman, known as Kallu Dhobi, is nowhere to be found. Finally, after cascading through the bewildering streets, Popatlal stumbles upon Kallu Dhobi.",20 mins,02 Nov 2018
92,2593,The Missing Lottery Ticket,"Popatlal gathers the courage to speak with Kallu Dhobi about the lottery ticket. Kallu Dhobi's heart melts after hearing that Popatlal is from Gokuldham society. Popatlal is relieved after hearing that Kallu Dhobi has safely kept the lottery ticket at his home. Popatlal reaches Kallu Dhobi's home and searches for the lottery ticket. But, the lottery ticket is nowhere to be found. Where is the lottery ticket?",20 mins,03 Nov 2018
93,2594,Following The Trail,"All the men are out trying to follow the trail of the lottery ticket. They realize that the ticket has been forwarded over and over again. Finally, they reach the end of the trail where the ticket is in the possession of Manu, who sells bhelpuri on a roadside stall.",20 mins,05 Nov 2018
94,2595,Popatlal's Act Of Kindness,"All the men gather in a park after they get to know that the lottery ticket might be there. When Popatlal gets in the possession of the lottery ticket, he gives it away to Manohar, who gave him the ticket in the first place. Why did Popatlal give the ticket away?",20 mins,06 Nov 2018
95,2596,Preparations For Diwali,Everyone in Gokuldham Society appreciates Popatlal for not accepting the winning amount of the lottery and giving it back to Manohar and how he has set an example for everyone else. Diwali is almost here and everyone starts their preparations. Bhide visits Taarak with some snacks to discuss various prospects for the celebration.,19 mins,07 Nov 2018
96,2597,The Diwali Pooja,Everyone in the Gokuldham society is excited for Diwali as they get their best dresses out for the Pooja. Dr. Hathi brings sweets and snacks for everyone. Taarak's wife asks him to eat all the snacks he wants but start his diet as soon as the celebration is over.,20 mins,08 Nov 2018
97,2598,Popatlal Brings The Crackers,Champaklal Gada tells everyone about the significance of the Lakshmi Pooja during Diwali as the priest does the rituals. Popatlal brings the crackers for everyone in the society. Watch the full episode and witness Diwali being celebrated the Gokuldham style.,19 mins,09 Nov 2018
98,2599,Popatlal's Bhai Dooj Misery,"It's Bhai Dooj and Popatlal wants to celebrate this festival of brothers and sisters with all the women of Gokuldham society. But when he goes to each of their houses to wish them and give them gifts, he feels ignored and neglected. Why is everyone neglecting Popatlal?",19 mins,12 Nov 2018
99,2600,A Surprise For Popatlal,"The ladies of Gokuldham society surprise Popatlal on the occasion of Bhai Dooj. Popatlal is overwhelmed seeing that he is loved by his sisters. Meanwhile, Jethalal finds himself in a new problem. He has lost the keys of Gada Electronics. Even after searching his house, Jethalal fails to find the keys, sending Champaklal in a panic.",20 mins,13 Nov 2018
